{
  "$schema": "https://json-schema.org/draft/2020-12/schema",
  "$id": "https://github.com/haziqfaris/AntaraX-Dashboard-kit/capacity/capacity.schema.json",
  "title": "Capacity",
  "description": "What one product or project runs on, every limit it can reach, how each is measured and what to do when it is crossed. Lives at capacity.json in the product's repository; AXLE's R8 → Capacity is drawn from it (axle SPEC §10.13). Vendor-neutral: any provider, any kind of infrastructure.",
  "type": "object",
  "required": ["product", "updated", "plans", "resources", "availability"],
  "additionalProperties": false,
  "properties": {
    "$schema": { "type": "string" },
    "product": { "description": "The product's id (antarax-api registry) or a client project's own id.", "type": "string", "pattern": "^[a-z][a-z0-9-]*$" },
    "updated": { "type": "string", "pattern": "^\\d{4}-\\d{2}-\\d{2}$" },
    "plans": {
      "description": "Every provider and plan the product runs on: the plan register.",
      "type": "array", "minItems": 1,
      "items": {
        "type": "object", "required": ["id", "provider", "plan", "confirmed"], "additionalProperties": false,
        "properties": {
          "id": { "type": "string", "pattern": "^[a-z][a-z0-9-]*$" },
          "provider": { "description": "Who runs it: a cloud, a host, REKA's own server.", "type": "string" },
          "service": { "description": "What it is, in plain words: managed Postgres, object storage, serverless functions, a VM, email sending…", "type": "string" },
          "plan": { "type": "string" },
          "confirmed": { "description": "False until someone has checked the plan in the provider's billing page. Shown as 'Not confirmed'.", "type": "boolean" },
          "cost": { "description": "Per month, as a string with its currency: 'US$25', 'RM0'.", "type": "string" },
          "region": { "type": "string" },
          "rules": { "description": "The plan's own rules that can stop the product, in words: idle pause, non-commercial use only, a project count.", "type": "array", "items": { "type": "string" } }
        }
      }
    },
    "resources": {
      "type": "array", "minItems": 1,
      "items": { "$ref": "#/$defs/resource" }
    },
    "availability": {
      "description": "The outside check (class Availability).",
      "type": "object", "required": ["url", "every_minutes", "from"], "additionalProperties": false,
      "properties": {
        "url": { "description": "A page that touches the database, so a paused or broken database fails the check.", "type": "string" },
        "every_minutes": { "type": "integer", "minimum": 1, "maximum": 15 },
        "from": { "description": "Where the check runs. Must be outside the product's own hosting.", "type": "string" },
        "promise": { "description": "Uptime promised to clients, if any: '99.5%'.", "type": "string" }
      }
    }
  },
  "$defs": {
    "resource": {
      "type": "object",
      "required": ["id", "class", "name", "plan", "unit", "limit", "measure", "decide"],
      "additionalProperties": false,
      "properties": {
        "id": { "type": "string", "pattern": "^[a-z][a-z0-9-]*$" },
        "class": { "description": "One of the standard classes (capacity/README.md).", "enum": ["data", "files", "transfer", "requests", "compute", "connections", "deployables", "jobs", "messages", "ai", "outside-apis", "backups"] },
        "name": { "description": "In plain words: 'Database size', 'Photos and receipts'.", "type": "string" },
        "plan": { "description": "The id of the plan whose limit this is.", "type": "string" },
        "unit": { "description": "bytes, requests/day, requests/month, ms-p95, connections, count, emails/day, emails/month, tokens/month, money/month, minutes, percent", "type": "string" },
        "limit": { "description": "The number the plan allows, in unit. null when the plan has no hard limit; then 'budget' must say what REKA allows itself.", "type": ["number", "null"] },
        "budget": { "description": "A limit REKA sets itself where the plan has none (pay-as-you-go), in unit.", "type": "number" },
        "per": { "description": "What the limit counts over, when it resets: 'day', 'month', 'billing-cycle', 'none'.", "enum": ["day", "month", "billing-cycle", "none"] },
        "measure": {
          "type": "object", "required": ["how"], "additionalProperties": false,
          "properties": {
            "how": { "description": "provider-api: the provider's usage endpoint. query: the product's own query (pg_database_size, a sum of file sizes). log: counted from the product's own records. manual: read by a person from a billing page, with the date. none: not measured yet.", "enum": ["provider-api", "query", "log", "manual", "none"] },
            "source": { "description": "The endpoint, query, table or page it comes from.", "type": "string" },
            "why_not": { "description": "When how is none: why, and what would measure it.", "type": "string" }
          }
        },
        "warn_at": { "description": "Percent of the limit that warns. 80 by default; may be lower, never higher.", "type": "number", "maximum": 80, "default": 80 },
        "runway_days": { "description": "A runway shorter than this warns. 30 by default; may be longer, never shorter.", "type": "number", "minimum": 30, "default": 30 },
        "decide": {
          "description": "What to do when it crosses, in order of preference. The page says it; it never acts.",
          "type": "array", "minItems": 1,
          "items": {
            "type": "object", "required": ["action", "what"], "additionalProperties": false,
            "properties": {
              "action": { "enum": ["upgrade-plan", "reduce-use", "change-architecture", "move-provider"] },
              "what": { "type": "string" },
              "cost": { "type": "string" }
            }
          }
        },
        "top": { "description": "What the opened resource lists as using it: 'tables', 'buckets', 'organisations', 'routes', 'jobs'.", "type": "array", "items": { "type": "string" } }
      }
    }
  }
}
